{
  "schema_version": "1.0",
  "action_id": "action_subscription_001_attempt_01",
  "case_id": "case_subscription_001",
  "merchant_id": "merchant_demo_001",
  "decision_receipt_id": "decision_case_subscription_001_v2",
  "action_type": "CREATE_PAYMENT_LINK",
  "target_type": "SUBSCRIPTION",
  "target_id": "subscription_001",
  "logical_attempt": 1,
  "idempotency_key": "merchant_demo_001:case_subscription_001:create_payment_link:1",
  "status": "PENDING",
  "parameters": {
    "amount_minor": 499900,
    "currency": "INR",
    "provider_mode": "TEST"
  },
  "authorized_at": "2026-08-25T16:31:02Z",
  "execute_after": "2026-08-25T16:31:02Z",
  "created_at": "2026-08-25T16:31:02Z",
  "updated_at": null
}
